{
	"name": "Monkey Meadow - Deflation",
	"map": "monkey_meadow",
	"difficulty": "easy",
	"mode": "deflation",
	"hero": "obyn",
	"towers": [
		{
			"tower": "hero",
			"location": {
				"x": 530,
				"y": 330
			}
		},
		{
			"tower": "bomb_shooter",
			"location": {
				"x": 334,
				"y": 266
			},
			"upgrades": [
				{
					"path": 1
				},
				{
					"path": 1
				},
				{
					"path": 2
				},
				{
					"path": 2
				},
				{
					"path": 2
				}
			],
			"target": "strong"
		},
		{
			"tower": "super_monkey",
			"location": {
				"x": 380,
				"y": 600
			},
			"upgrades": [
				{
					"path": 1
				},
				{
					"path": 1
				},
				{
					"path": 3
				},
				{
					"path": 3
				},
				{
					"path": 3
				}
			]
		},
		{
			"tower": "spike_factory",
			"location": {
				"x": 957,
				"y": 407
			}
		}
	]
}
